{
  "id": "ev-test-001",
  "incident_id": "inc-test-001",
  "type": "EVIDENCE_TYPE_LOG_EXCERPT",
  "collected_at": "2026-09-12T09:04:00Z",
  "source": "waf-sim-lab",
  "media_type": "text/plain",
  "sha256": "e3b0c44298fc1c149afbf4c8996fb92427ae41e4649b934ca495991b7852b855",
  "content": "synthetic contract test data — not a real security finding"
}
